state,msg,choicesButton,nextFunc,always
topConv,Let\'s play a quiz,['Start'],['score=0;'],curState = s1; 
s1,Rome is the capital of which country?,"['Czech','Italy','Cuba','China']","['score += 0;','score+=1;','score+=0;','score+=0;']",curState = s2;
s2,Moscow is the capital of which country?,"['Czech', 'Germany', 'Sweden', 'Russia']","['score += 0;','score+=0;','score+=0;','score+=1;']",curState = result;
result,Click to show your score,['ShowScore'],[''],"curState = end; addHistory(\'bot\',score.toString());"
end,Thanks for playing,[],[],